{
  "event": "stream.sealed",
  "delivery": "01J8ZCH3W9K5NQX2VR7TMB4PD6",
  "occurred_at": "2026-08-28T21:44:31.88Z",
  "node": "origin-atl-01",
  "node_role": "origin",
  "contract_version": 1,
  "stream": "show-2041-main",
  "delivery_mode": "bucket",
  "vod": {
    "master": "https://cdn.example.com/hls/show-2041-main/playlist.m3u8",
    "renditions": {
      "480p": "https://cdn.example.com/hls/show-2041-main/480p.m3u8",
      "720p": "https://cdn.example.com/hls/show-2041-main/720p.m3u8",
      "audio": "https://cdn.example.com/hls/show-2041-main/audio.m3u8"
    },
    "preview": null,
    "captions": {
      "en": {
        "playlist": "https://cdn.example.com/hls/show-2041-main/captions_en.m3u8",
        "vtt": "https://cdn.example.com/hls/show-2041-main/captions/en/transcript.vtt",
        "srt": "https://cdn.example.com/hls/show-2041-main/captions/en/transcript.srt",
        "json": "https://cdn.example.com/hls/show-2041-main/captions/en/transcript.json"
      }
    }
  },
  "duration_seconds": 9143.2,
  "segment_count": 1524,
  "discontinuity_count": 2,
  "dropped_segments": 0,
  "sessions": 1,
  "first_program_date_time": "2026-08-28T19:12:08Z",
  "sealed_by": "api_delete",
  "labels": {
    "show_id": "2041",
    "site": "csn"
  }
}
